{
  "slug": "example-plant",
  "common_name": "Example Plant",
  "name_latin": "Examplea officinalis",
  "family": "",
  "parts_used": [],
  "traditional_use_summary": "",
  "age_restrictions": [],
  "max_duration_dose": [],
  "toxicity_signals": [],
  "hard_caution": false,
  "contraindications": [],
  "interactions": [],
  "pregnancy_warning_text": "",
  "allergy_note": "",
  "sources": []
}
